username,timestamp_text,comment_text,cleaned_tokens,cleaned_text
@milojadez,14 hours ago,"There are people out there that actually are able to read minds and solve murders unexplainably, this guy just found his way to gain from it.",people|actually|able|read|mind|solve|murder|unexplainably|guy|found|way|gain,people actually able read mind solve murder unexplainably guy found way gain
@JasonWestaway,22 hours ago,"Wow, that was insane!",wow|insane,wow insane
@THEHONESTREPLAY,1 day ago,"That's all are fake,  Edited,  i challenged,",thats|fake|edited|challenged,thats fake edited challenged
@serenaLei06,1 day ago,"Wait, how did he do that?",wait,wait
@ainomugishanancy206,1 day ago,"If i know how people think,i know what they think.",know|people|thinki|know|think,know people thinki know think
@adlpellerin,2 days ago,"So what's the conclusion ? I also knew it was Barack Obama so what does it means, why did I feel that and how ? I can't imagine that it was a lucky guess, can I ?! TED, don't leave us without a conclusion, that is not like you! haha",whats|conclusion|also|knew|barack|obama|mean|feel|cant|imagine|lucky|guess|ted|dont|leave|without|conclusion|like|haha,whats conclusion also knew barack obama mean feel cant imagine lucky guess ted dont leave without conclusion like haha
@lindam7430,2 days ago,Please read Pres DJT's mind and tell him to knock it off !!,please|read|pres|djts|mind|tell|knock,please read pres djts mind tell knock
@PeeyushK-jq3ol,2 days ago,i really feel like a scam but .....Ted talk ...?,really|feel|like|scam|ted|talk,really feel like scam ted talk
@NicknSuzSegura,3 days ago,Queen  Latifa,queen|latifa,queen latifa
@Abstractless,4 days ago,"Fake most probably. They both in same team from his expression. Alexander the Great, fine, idk anyone could come up with any name that no one knows like maybe Indian old saint",fake|probably|team|expression|alexander|great|fine|idk|anyone|could|come|name|one|know|like|maybe|indian|old|saint,fake probably team expression alexander great fine idk anyone could come name one know like maybe indian old saint
@junemoonchild69,4 days ago,"He's simply manipulating people, watching their body language, using the logic of natural odds...and he likely makes more mistakes than what you see edited for television. Boring and been done already...",he|simply|manipulating|people|watching|body|language|using|logic|natural|oddsand|likely|make|mistake|see|edited|television|boring|done|already,he simply manipulating people watching body language using logic natural oddsand likely make mistake see edited television boring done already
@pbone32,4 days ago,"so Oz kept saying ""you have to believe it in order to achieve it"". Which Google finishes a search entry with...Barack Obama... It didn't trigger for me, but I guess it did for Brett? ...and I only remember his name because he stressed the two Ts.",kept|saying|believe|order|achieve|google|finish|search|entry|withbarack|obama|didnt|trigger|guess|brett|remember|name|stressed|two,kept saying believe order achieve google finish search entry withbarack obama didnt trigger guess brett remember name stressed two
@seamourhiney,5 days ago,"You might bill YOURSELF as the “World’s Greatest Mind Reader”, but there are those of us who KNOW - that you’re barely an average magician who was lucky enough to find himself a really good Publicist!",might|bill|world|greatest|mind|reader|know|youre|barely|average|magician|lucky|enough|find|really|good|publicist,might bill world greatest mind reader know youre barely average magician lucky enough find really good publicist
@SecureBizOfficial,5 days ago,"Oz Pearlman is truly a master of behavioral psychology! 🧠 His quote, 'If I knew how you think, I would know what you think' [00:36] is a sharp reminder for us at Secure Biz. In the security world, we know that humans are often the weakest link, and social engineering is how hackers 'read' us, just like Oz did on stage. I was very impressed with the 'Listen - Repeat - Respond' process [06:13]. This isn't just about remembering names, but about actually being present and building trust—the most important thing in any security system. Oz's confidence in the outcome [11:04] is the philosophy we strive for when setting up protection solutions for our clients: absolute peace of mind. Thank you to TED for sharing this inspiring presentation. This video reminds us that: to protect the system, we must first understand our own minds!",pearlman|truly|master|behavioral|psychology|quote|knew|think|would|know|think|sharp|reminder|secure|biz|security|world|know|human|often|weakest|link|social|engineering|hacker|read|like|stage|impressed|listen|repeat|respond|process|isnt|remembering|name|actually|present|building|trustthe|important|thing|security|system|ozs|confidence|outcome|philosophy|strive|setting|protection|solution|client|absolute|peace|mind|thank|ted|sharing|inspiring|presentation|video|reminds|protect|system|must|first|understand|mind,pearlman truly master behavioral psychology quote knew think would know think sharp reminder secure biz security world know human often weakest link social engineering hacker read like stage impressed listen repeat respond process isnt remembering name actually present building trustthe important thing security system ozs confidence outcome philosophy strive setting protection solution client absolute peace mind thank ted sharing inspiring presentation video reminds protect system must first understand mind
@richardthomas1408,5 days ago,"Its almost like if you follow closely. It explains what is happening today. And by the comments, proves it works. Lol",almost|like|follow|closely|explains|happening|today|comment|prof|work|lol,almost like follow closely explains happening today comment prof work lol
@latestinfotv8147,6 days ago,Is this AGT btw?😅,agt|btw,agt btw
@onsearchfocus,6 days ago,"WTF?? How? I mean, H O W? I know he scanned the room and picked people easier to read. Still, how?? Impressive.",wtf|mean|know|scanned|room|picked|people|easier|read|still|impressive,wtf mean know scanned room picked people easier read still impressive
@LebenGamezso1slOo01l,6 days ago,"Flavor of the month, he is doing nothing that many many havent done before.  Just the young generations havent been around to see the older ones do it, so its all new to them.",flavor|month|nothing|many|many|havent|done|young|generation|havent|around|see|older|one|new,flavor month nothing many many havent done young generation havent around see older one new
@johnsample5278,6 days ago,"So now I need to remember a trick so I can remember people’s names. If I could do that, I’d just remember their names. Feels like we’re moving in the wrong direction.",need|remember|trick|remember|people|name|could|remember|name|feel|like|moving|wrong|direction,need remember trick remember people name could remember name feel like moving wrong direction
@AdiVibeShots,6 days ago,Wtf even I guessed Barack Obama😢,wtf|even|guessed|barack|obama,wtf even guessed barack obama
@expo-native,6 days ago,As an AI Engineer I keep updated with Oz due to his absolute and undefined brilliance in which opens doors to an open space in my mind with new opportunity.,engineer|keep|updated|due|absolute|undefined|brilliance|open|door|open|space|mind|new|opportunity,engineer keep updated due absolute undefined brilliance open door open space mind new opportunity
@yumorok_tut,6 days ago,"O man, you are great ❤❤",man|great,man great
@davidmcdonnell767,6 days ago,You can have dinner with anyone alive or dead...and u choose O'bama 🤣,dinner|anyone|alive|deadand|choose|obama,dinner anyone alive deadand choose obama
@simonforbes2453,6 days ago,Stooooooges!!,stooooooges,stooooooges
@khalilmatar8474,7 days ago,"So what is the lesson here, other than recalling peoples' names?",lesson|recalling|people|name,lesson recalling people name
@ONEQUESTION_YT,7 days ago,So informative 🎉,informative,informative
@TaedyBear-ms3kz,7 days ago,"Oh oh... I used to read comments before watching videos, so I'm not watching this.",used|read|comment|watching|video|watching,used read comment watching video watching
@ShodiyabegimQulmurodova,7 days ago,This is the best show i ever watch,best|show|ever|watch,best show ever watch
@sln7839,7 days ago,Don't read anyone's mind and spoil your peace.,dont|read|anyones|mind|spoil|peace,dont read anyones mind spoil peace
@fenderbendermender7253,7 days ago,I would of never guessed anyone would want to have dinner with Trevor Noah...,would|never|guessed|anyone|would|want|dinner|trevor|noah,would never guessed anyone would want dinner trevor noah
@MaidahHabib,7 days ago,"Was it scripted or not? I'm soo confused! Btw,he's amazing!!! 🤯",scripted|soo|confused|btwhes|amazing,scripted soo confused btwhes amazing
@Sherif.Fanous,8 days ago,I can’t believe that anyone actually believe this B.S. So so so fake,cant|believe|anyone|actually|believe|fake,cant believe anyone actually believe fake
@maverick627uk,8 days ago,Greatest mind reader? 🤣🤣🤣🤣🤣🤣,greatest|mind|reader,greatest mind reader
@klaasklinkert505,9 days ago,He selects the people. And is that a normal frisbee flight? Great trick.,selects|people|normal|frisbee|flight|great|trick,selects people normal frisbee flight great trick
@bobbymckenzie3202,9 days ago,He's a CIA project,he|cia|project,he cia project
@Sabrina.682,9 days ago,"Even if this is all staged, why do so many people care? He's not hurting anyone. It's just entertainment.",even|staged|many|people|care|he|hurting|anyone|entertainment,even staged many people care he hurting anyone entertainment
@ishansingh7531,9 days ago,What are the odds if that’s a set up!,odds|thats|set,odds thats set
@usfzia,10 days ago,scripted lol,scripted|lol,scripted lol
@jaylont6056,10 days ago,Mind BLOWN,mind|blown,mind blown
@theduder2617,11 days ago,"Plants are so useful. If you like magic and/or mystery, never peek behind the curtain. It's not as fantastical after you look. On the other hand, such a peek opens up the ability to detect deception in other aspects of daily life. I am glad I took my peak long ago.",plant|useful|like|magic|andor|mystery|never|peek|behind|curtain|fantastical|look|hand|peek|open|ability|detect|deception|aspect|daily|life|glad|took|peak|long|ago,plant useful like magic andor mystery never peek behind curtain fantastical look hand peek open ability detect deception aspect daily life glad took peak long ago
@minion3514,11 days ago,That was definitely a script,definitely|script,definitely script
@snooptech,11 days ago,its a set up,set,set
@danloehr4488,11 days ago,So fake lol,fake|lol,fake lol
@GreisonJoseOlivaDePaz,11 days ago,Who else guessed BO before he did also 😮🙋🏽‍♂️,else|guessed|also,else guessed also
@troymykink6322,11 days ago,Omgosh! I can't believe this con man is on Ted talk. Do you guys not even vet your guests anymore or what? Wow! I guess I ought to be a little bit more careful with trusting TED Talk now. Cuz this guy is a straight-up con man and liar to the very core. I I am totally flabbergasted and I cannot believe this guy has made it onto TED Talk! Absolutely shameful,omgosh|cant|believe|con|man|ted|talk|guy|even|vet|guest|anymore|wow|guess|ought|little|bit|careful|trusting|ted|talk|cuz|guy|straightup|con|man|liar|core|totally|flabbergasted|believe|guy|made|onto|ted|talk|absolutely|shameful,omgosh cant believe con man ted talk guy even vet guest anymore wow guess ought little bit careful trusting ted talk cuz guy straightup con man liar core totally flabbergasted believe guy made onto ted talk absolutely shameful
@MicahZimmerman-x7b,12 days ago,Chills,chill,chill
@newh0001,12 days ago,"...I'm thinking of P.T. Barnum, you know...the guy who said, ""there's a sucker born every minute"".",thinking|barnum|knowthe|guy|said|there|sucker|born|every|minute,thinking barnum knowthe guy said there sucker born every minute
@francesco777777,13 days ago,Clearly he can read minds.,clearly|read|mind,clearly read mind
@sarahbee13,13 days ago,He’s lying. He actually reads minds. And that’s the REAL scam. And no I’m not lying,he|lying|actually|read|mind|thats|real|scam|lying,he lying actually read mind thats real scam lying
@patakoripelomundo5362,13 days ago,Brett Light-year,brett|lightyear,brett lightyear
@lookupAndy,13 days ago,10:18 I'm pretty sure he looked up to see the 10 minute timer warning him to wrap up (and then he was confused because he was told he'd have more than 10 minutes!)😅,pretty|sure|looked|see|minute|timer|warning|wrap|confused|told|hed|minute,pretty sure looked see minute timer warning wrap confused told hed minute
@DonCarnage42,13 days ago,"He's certainly ventured somewhat astray from the classic mentalist show, into charlatan con man territory recently. Guess the money were too good. Shame for TED to promote his scam though.",he|certainly|ventured|somewhat|astray|classic|mentalist|show|charlatan|con|man|territory|recently|guess|money|good|shame|ted|promote|scam|though,he certainly ventured somewhat astray classic mentalist show charlatan con man territory recently guess money good shame ted promote scam though
@ontheroadagain987,13 days ago,"The recent unilateral military extraction of Nicolás Maduro to New York, coupled with the open disregard for the territorial integrity of nations like Greenland and Canada, marks a dangerous escalation in American foreign policy that the world can no longer ignore. These actions demonstrate a blatant rejection of international law and a return to imperialist coercion, threatening the sovereignty of every independent state. To stand idly by is to accept a future where global boundaries are drawn by force rather than consensus. It is time for the international community to unite in a targeted boycott of US goods and services, sending a clear, economic message that this unchecked hegemonisation will not be tolerated and that the path to a just global order lies in multipolarity and mutual respect, not domination.",recent|unilateral|military|extraction|nicols|maduro|new|york|coupled|open|disregard|territorial|integrity|nation|like|greenland|canada|mark|dangerous|escalation|american|foreign|policy|world|longer|ignore|action|demonstrate|blatant|rejection|international|law|return|imperialist|coercion|threatening|sovereignty|every|independent|state|stand|idly|accept|future|global|boundary|drawn|force|rather|consensus|time|international|community|unite|targeted|boycott|good|service|sending|clear|economic|message|unchecked|hegemonisation|tolerated|path|global|order|lie|multipolarity|mutual|respect|domination,recent unilateral military extraction nicols maduro new york coupled open disregard territorial integrity nation like greenland canada mark dangerous escalation american foreign policy world longer ignore action demonstrate blatant rejection international law return imperialist coercion threatening sovereignty every independent state stand idly accept future global boundary drawn force rather consensus time international community unite targeted boycott good service sending clear economic message unchecked hegemonisation tolerated path global order lie multipolarity mutual respect domination
@kajachris11,13 days ago,Wait.. He didn't explain anything.. That wasn't a TED talk .. That was a performance.,wait|didnt|explain|anything|wasnt|ted|talk|performance,wait didnt explain anything wasnt ted talk performance
@GandillSwaggins,2 weeks ago,"Ashley taught me L.R.R. 🎉. Naw neg comments are a not prepared to absorb or B are wired differently. Not saying that is bad, people have strengths all over.  Its entertaining",ashley|taught|lrr|naw|neg|comment|prepared|absorb|wired|differently|saying|bad|people|strength|entertaining,ashley taught lrr naw neg comment prepared absorb wired differently saying bad people strength entertaining
@lutfunnesasuzana661,2 weeks ago,Wtf was that,wtf,wtf
@serekapsik,2 weeks ago,I thought Barak Obama too! How’s this possible?!?,thought|barak|obama|hows|possible,thought barak obama hows possible
@JatinBisht-l1l,2 weeks ago,That last part was hilarious.,last|part|hilarious,last part hilarious
@OmSh-k3y,2 weeks ago,"If the universe had a beginning, it must have a cause beyond itself. Science explains how things work, but not why existence exists at all. If there is a Creator, then life is not random. A wise Creator would not create such a precise universe and leave humanity without purpose, guidance, or meaning. Throughout history, humans have disagreed deeply about morality and truth — which makes revelation necessary. If God created us, it is reasonable that He sent messengers to explain why we exist and how we should live. To identify the true path, we must ask: What is God’s nature? Is He one, perfect, eternal, and unlike creation? Islam affirms this clearly: One God, without partners or incarnation, with the most perfect names and attributes. Christianity introduces complex doctrines like the Trinity and incarnation, which raise serious philosophical questions about divine unity and perfection. The question is not cultural or emotional — it is logical: Which belief about God best preserves His oneness, perfection, and purpose?",universe|beginning|must|cause|beyond|science|explains|thing|work|existence|exists|creator|life|random|wise|creator|would|create|precise|universe|leave|humanity|without|purpose|guidance|meaning|throughout|history|human|disagreed|deeply|morality|truth|make|revelation|necessary|god|created|reasonable|sent|messenger|explain|exist|live|identify|true|path|must|ask|god|nature|one|perfect|eternal|unlike|creation|islam|affirms|clearly|one|god|without|partner|incarnation|perfect|name|attribute|christianity|introduces|complex|doctrine|like|trinity|incarnation|raise|serious|philosophical|question|divine|unity|perfection|question|cultural|emotional|logical|belief|god|best|preserve|oneness|perfection|purpose,universe beginning must cause beyond science explains thing work existence exists creator life random wise creator would create precise universe leave humanity without purpose guidance meaning throughout history human disagreed deeply morality truth make revelation necessary god created reasonable sent messenger explain exist live identify true path must ask god nature one perfect eternal unlike creation islam affirms clearly one god without partner incarnation perfect name attribute christianity introduces complex doctrine like trinity incarnation raise serious philosophical question divine unity perfection question cultural emotional logical belief god best preserve oneness perfection purpose
@FROMZERO99,2 weeks ago,"​""Thank you for sharing. You’ve given me the strength I didn’t know I needed.""",thank|sharing|youve|given|strength|didnt|know|needed,thank sharing youve given strength didnt know needed
@masmo4779,2 weeks ago,Hard to believe,hard|believe,hard believe
@ibrahimfahmy1968,2 weeks ago,But.. How,,
@HIRO-kd5pm,2 weeks ago,I still struggling to talk with anyone in perticular,still|struggling|talk|anyone|perticular,still struggling talk anyone perticular
@chelseah9254,2 weeks ago,I mean… if this was a question on family feud I feel like top 10 would obv have President Obama and Trevor Noah anyways ❤😂,mean|question|family|feud|feel|like|top|would|obv|president|obama|trevor|noah|anyways,mean question family feud feel like top would obv president obama trevor noah anyways
@starwisdom6646,2 weeks ago,nice script.,nice|script,nice script
@juwaybir,2 weeks ago,I wish I could take my 10 minutes back! Total nonsense.,wish|could|take|minute|back|total|nonsense,wish could take minute back total nonsense
@awara_mystry,2 weeks ago,"I was expecting to learn read minds but I learnt only to remember people's name, which method I already know I just lack social skills to apply it 😅",expecting|learn|read|mind|learnt|remember|people|name|method|already|know|lack|social|skill|apply,expecting learn read mind learnt remember people name method already know lack social skill apply
@Ivy-listens,2 weeks ago,My flabbers are totally gasted cuz I was thinking of Barack Obama 😮 man that's so cool!,flabbers|totally|gasted|cuz|thinking|barack|obama|man|thats|cool,flabbers totally gasted cuz thinking barack obama man thats cool
@rongitmukherjee,2 weeks ago,Only taught how to remember names,taught|remember|name,taught remember name
@wongholaam2098,2 weeks ago,Telepathy going viral now?,telepathy|going|viral,telepathy going viral
@AnantSinghrajput-l9y4r,2 weeks ago,In India we also have one like you -- bageshwar baba😂😂,india|also|one|like|bageshwar|baba,india also one like bageshwar baba
@maksman.maurice,2 weeks ago,Seems2me@staged!........impressive though.,seemsmestagedimpressive|though,seemsmestagedimpressive though
@pittwaterplayground,2 weeks ago,"I was very impressed with this lecture, but after Googling him I found many reports of him being nothing more than a good magician and his mentalist skills are a fraud. Still, some good skills learnt.",impressed|lecture|googling|found|many|report|nothing|good|magician|mentalist|skill|fraud|still|good|skill|learnt,impressed lecture googling found many report nothing good magician mentalist skill fraud still good skill learnt
@prtcgv5105,2 weeks ago,I can read minds... I married a woman.,read|mind|married|woman,read mind married woman
@lafangeyparindey3319,2 weeks ago,not going to lie but I guessed that the old one is going to name some american president and on my back mind I guessed it was barack obama,going|lie|guessed|old|one|going|name|american|president|back|mind|guessed|barack|obama,going lie guessed old one going name american president back mind guessed barack obama
@anupamchoudhary,2 weeks ago,Me too thinking about Barack obama,thinking|barack|obama,thinking barack obama
@angietheodorakis9314,2 weeks ago,I've always said this to my adult students that I teach...When you meet someone...'repeat' their names-visualize someone they remind you of-form a correlation'...works every time!!,ive|always|said|adult|student|teachwhen|meet|someonerepeat|namesvisualize|someone|remind|ofform|correlationworks|every|time,ive always said adult student teachwhen meet someonerepeat namesvisualize someone remind ofform correlationworks every time
@winglift8156,2 weeks ago,"Sorry, I don't believe it.",sorry|dont|believe,sorry dont believe
@brianjoseph7132,2 weeks ago,This guy is full of bs...how are we having a 'people reader' full of bs gimmicks giving a ted talk...what has this organization come to,guy|full|bshow|people|reader|full|gimmick|giving|ted|talkwhat|organization|come,guy full bshow people reader full gimmick giving ted talkwhat organization come
@rickwarda1838,2 weeks ago,Who im the world would want a meal with Barak Obama??? Why?,world|would|want|meal|barak|obama,world would want meal barak obama
@thegoudaguymikey,2 weeks ago,"2 plants, 2 civilians. One tech board, one genuine marker board.",plant|civilian|one|tech|board|one|genuine|marker|board,plant civilian one tech board one genuine marker board
@thegoudaguymikey,2 weeks ago,"Never mind the fact that he ""wrote"" 4 letters on one line... Then the card has Trevor Noah written on it  in two lines",never|mind|fact|wrote|letter|one|line|card|trevor|noah|written|two|line,never mind fact wrote letter one line card trevor noah written two line
@oscarskidoo9884,2 weeks ago,Bra wtf does guessing Alexandra the great do with forgetting people names😑😑wtf happened after the magic 🤣🤣,bra|wtf|guessing|alexandra|great|forgetting|people|nameswtf|happened|magic,bra wtf guessing alexandra great forgetting people nameswtf happened magic
@BibleVerses4all,2 weeks ago,"I honestly feel sorry for this guy''s wife, kids and even neighbors.",honestly|feel|sorry|guy|wife|kid|even|neighbor,honestly feel sorry guy wife kid even neighbor
@HabitsToWealthHQ,3 weeks ago,Is it possible to read the minds of other 😅,possible|read|mind,possible read mind
@wolfsisters3043,3 weeks ago,They always pick famous people,always|pick|famous|people,always pick famous people
@222ukie,3 weeks ago,this was more scripted than wrestling,scripted|wrestling,scripted wrestling
@AlluyahTheGvngsta,3 weeks ago,What a script nice performance 👏,script|nice|performance,script nice performance
@stutisingh-g7r,3 weeks ago,this was more like a show.. there was no technique taught,like|show|technique|taught,like show technique taught
@waero1960,3 weeks ago,Should be the top criminal investigator in the world,top|criminal|investigator|world,top criminal investigator world
@SophieAnderson-z1b,3 weeks ago,"DUDEEEE, I chose Obama too",dudeeee|chose|obama,dudeeee chose obama
@babu357,3 weeks ago,"I feel this would be more appropriate for ""Ellen', than TED. 🤣 I would have liked a TED talk where he explained how he got his answers but since he does this for entertainment purposes I guess that wouldn't make sense to divulge his secrets.",feel|would|appropriate|ellen|ted|would|liked|ted|talk|explained|got|answer|since|entertainment|purpose|guess|wouldnt|make|sense|divulge|secret,feel would appropriate ellen ted would liked ted talk explained got answer since entertainment purpose guess wouldnt make sense divulge secret
@tharindu6405,3 weeks ago,Anyone imagined Brad Pitt? I read your mind.,anyone|imagined|brad|pitt|read|mind,anyone imagined brad pitt read mind
@BobbyDotNet,3 weeks ago,Can't help feeling like there was some interaction with Brett that we weren't shown in this video.,cant|help|feeling|like|interaction|brett|werent|shown|video,cant help feeling like interaction brett werent shown video
@tlgonline,3 weeks ago,It's all staged. I don't believe it.,staged|dont|believe,staged dont believe
@the3xtr3mist,3 weeks ago,I don't believe this not in a million lifetimes,dont|believe|million|lifetime,dont believe million lifetime
