username,timestamp_text,comment_text,cleaned_tokens,cleaned_text
@debuisthat,3 weeks ago,"How do you know all these tricks,,, I really wanna know how can a human mind do this ,,,,",know|trick|really|wan|know|human|mind,know trick really wan know human mind
@ahmedbadey,3 weeks ago,Omg.. I predicted he would say barak obama because i could see it in his face min 13:37,omg|predicted|would|say|barak|obama|could|see|face|min,omg predicted would say barak obama could see face min
@BaqayeeJourney,3 weeks ago,gee,gee,gee
@draco_0073,3 weeks ago,Akkinator real life,akkinator|real|life,akkinator real life
@MariyamNuha-j8o,3 weeks ago,This part of the show is told me to learn how to remember a stranger when you met at first time The video was a part from thumbnail but it's okay becoz i didn't waste my time learn incredible life lesson I never forgot about it Like comment If your thought am right,part|show|told|learn|remember|stranger|met|first|time|video|part|thumbnail|okay|becoz|didnt|waste|time|learn|incredible|life|lesson|never|forgot|like|comment|thought|right,part show told learn remember stranger met first time video part thumbnail okay becoz didnt waste time learn incredible life lesson never forgot like comment thought right
@blairfggk120,3 weeks ago,Oh mindcraft not Minecraft,mindcraft|minecraft,mindcraft minecraft
@minulacoolsoul7221,3 weeks ago,"😂😂😂 unsubscribed Ted talks, Misleading content. Good bye",unsubscribed|ted|talk|misleading|content|good|bye,unsubscribed ted talk misleading content good bye
@Alex-zy5td,3 weeks ago,Imagine not recognizing a staged show in 2025,imagine|recognizing|staged|show,imagine recognizing staged show
@raaavxn,3 weeks ago,The most difficult part of designing a Perpetual Motion Machine is deciding where to hide the batteries.,difficult|part|designing|perpetual|motion|machine|deciding|hide|battery,difficult part designing perpetual motion machine deciding hide battery
@wikky16,3 weeks ago,The body guard near to witters help tell on microphone to stage man right that is my mind reading 🎉,body|guard|near|witters|help|tell|microphone|stage|man|right|mind|reading,body guard near witters help tell microphone stage man right mind reading
@AuraBloom-8,4 weeks ago,"""Give me another clap""",give|another|clap,give another clap
@logicalmallu,4 weeks ago,"We indians got more than of mentalism... We have got astrology and many traditional wisdom, through which we can find out our previous birth",indian|got|mentalism|got|astrology|many|traditional|wisdom|find|previous|birth,indian got mentalism got astrology many traditional wisdom find previous birth
@roberthigbee3260,4 weeks ago,Nobody said Jesus.,nobody|said|jesus,nobody said jesus
@wealthascendants-l7z,4 weeks ago,Super,super,super
@icnweb3news,4 weeks ago,Brilliant speech. Thank you for these valuable insights 🫵🏻,brilliant|speech|thank|valuable|insight,brilliant speech thank valuable insight
@tompapps7810,4 weeks ago,How to read minds with magic would be more impressive,read|mind|magic|would|impressive,read mind magic would impressive
@getleonamini3489,4 weeks ago,West Reading mind Here;  ankh me sour ka bal,west|reading|mind|ankh|sour|bal,west reading mind ankh sour bal
@sterlthepearl1000,4 weeks ago,"Magic is the total defiance, of all natural laws and science. With magic, the impossible becomes possible. 🦉",magic|total|defiance|natural|law|science|magic|impossible|becomes|possible,magic total defiance natural law science magic impossible becomes possible
@kennethwong7243,1 month ago,OZ has been exposed as a simple good magician.  Fun entertainment but uses a thumb pen to write as people talk.  Many Youtube videos showing his tricks.  He is not a mentalist.  but a magician.,exposed|simple|good|magician|fun|entertainment|us|thumb|pen|write|people|talk|many|youtube|video|showing|trick|mentalist|magician,exposed simple good magician fun entertainment us thumb pen write people talk many youtube video showing trick mentalist magician
@AnnaOliviayy,1 month ago,But I'd rather learn how to read minds WITH magic :(,rather|learn|read|mind|magic,rather learn read mind magic
@proshepherd,1 month ago,I will never believe it's not staged,never|believe|staged,never believe staged
@jfuriathemostwanted5414,1 month ago,Total clown,total|clown,total clown
@MannyAAvila,1 month ago,"He is pre-screening the people he will ask to participate, without their knowledge. And not even himself doing the prescreening, but his assistants. Before the show the show the assistant does not ask the participant the actual questions. Instead, they gather related evidence. Then they can communicate this information to him, sometimes in real time over an earpiece, which gives him a huge leg up in reaching the right answer. Spiritualists /Mediums do the same thing.  He is still very talented.",prescreening|people|ask|participate|without|knowledge|even|prescreening|assistant|show|show|assistant|ask|participant|actual|question|instead|gather|related|evidence|communicate|information|sometimes|real|time|earpiece|give|huge|leg|reaching|right|answer|spiritualist|medium|thing|still|talented,prescreening people ask participate without knowledge even prescreening assistant show show assistant ask participant actual question instead gather related evidence communicate information sometimes real time earpiece give huge leg reaching right answer spiritualist medium thing still talented
@stephy369,1 month ago,I don't like when people use my name if they don't know me... Saying it multiple times when I first meet you is annoying and feels fake.,dont|like|people|use|name|dont|know|saying|multiple|time|first|meet|annoying|feel|fake,dont like people use name dont know saying multiple time first meet annoying feel fake
@mtszone2466,1 month ago,"So HOW do you do it, like, the last guy, brett, got it right, but how....",like|last|guy|brett|got|right,like last guy brett got right
@neerajsr7,1 month ago,13:42 He opened his eyes before being asked to! Staged or not?,opened|eye|asked|staged,opened eye asked staged
@brioac,1 month ago,this was clickbate for sure!!!!,clickbate|sure,clickbate sure
@marginalized945,1 month ago,Alexander the Great. YEAH RIGHT!!😂😂😂😂,alexander|great|yeah|right,alexander great yeah right
@marginalized945,1 month ago,This dude is an actor putting on a show. Nothing more. Everything is prearranged and it's packaged as information but in reality it's just entertainment.,dude|actor|putting|show|nothing|everything|prearranged|packaged|information|reality|entertainment,dude actor putting show nothing everything prearranged packaged information reality entertainment
@karmkathiyawadi142,1 month ago,what if you just dont know the person,dont|know|person,dont know person
@johnchapman1231,1 month ago,fixed,fixed,fixed
@GWillifredB,1 month ago,"""Baldy, your head is bald. It is hairless. It is shiny, it is reflective like a mirror. ""M"" your name is Mark.""",baldy|head|bald|hairless|shiny|reflective|like|mirror|name|mark,baldy head bald hairless shiny reflective like mirror name mark
@Sicarius089,1 month ago,"I kid you not I even got the name right at the end before it was even said. An odd experience years a go, I was speaking to a regular customer, he asked my name I told him, (I was thinking his name's Paul) I then asked him his name and he said ""Paul"". There seriously needs to be a science behind such things.",kid|even|got|name|right|end|even|said|odd|experience|year|speaking|regular|customer|asked|name|told|thinking|name|paul|asked|name|said|paul|seriously|need|science|behind|thing,kid even got name right end even said odd experience year speaking regular customer asked name told thinking name paul asked name said paul seriously need science behind thing
@mikewood9173,1 month ago,he is a fraud. not in the old sense. he has camera tech earpiece tech and uses planted people in the audience.,fraud|old|sense|camera|tech|earpiece|tech|us|planted|people|audience,fraud old sense camera tech earpiece tech us planted people audience
@AXON619_,1 month ago,Hey people from 2027 it's not AI just a pure scam,hey|people|pure|scam,hey people pure scam
@Ma-Sia,1 month ago,"Oz Pearlman is the biggest BS artist, snake-tongue, con-man of our time!!!  His ties to Israeli intelligence are scary.  However he is doing this should be viewed as a risk/threat to national security.  I have a masters in psychology, the things he says about people's hands and eyes are 100% BS LIES!!!  Whatever techniques he is using to accomplish this level of ""mentalism"" have to be illegal if they are not audience plants.  Understanding and studying the techniques of ""mentalism"" he must be using invasive Israeli intelligence gathering like Pegasus combined with A.I.  A government investigation into this man would be warranted.",pearlman|biggest|artist|snaketongue|conman|time|tie|israeli|intelligence|scary|however|viewed|riskthreat|national|security|master|psychology|thing|say|people|hand|eye|lie|whatever|technique|using|accomplish|level|mentalism|illegal|audience|plant|understanding|studying|technique|mentalism|must|using|invasive|israeli|intelligence|gathering|like|pegasus|combined|government|investigation|man|would|warranted,pearlman biggest artist snaketongue conman time tie israeli intelligence scary however viewed riskthreat national security master psychology thing say people hand eye lie whatever technique using accomplish level mentalism illegal audience plant understanding studying technique mentalism must using invasive israeli intelligence gathering like pegasus combined government investigation man would warranted
@anthonyshaw7445,1 month ago,Omfg I actually thought Barack Obama at that exact moment!!!!!!!!!!!,omfg|actually|thought|barack|obama|exact|moment,omfg actually thought barack obama exact moment
@simontrowell,1 month ago,How on earth can he guess Alexander the Great from looking at someone for 30 seconds. Absolute rubbish.,earth|guess|alexander|great|looking|someone|second|absolute|rubbish,earth guess alexander great looking someone second absolute rubbish
@simplyone200,1 month ago,Dad has this super power he know about my dating life and personal life Creepy Wondering how Tried every way possible to keep personal things to my self Counselor rules out paranoia,dad|super|power|know|dating|life|personal|life|creepy|wondering|tried|every|way|possible|keep|personal|thing|self|counselor|rule|paranoia,dad super power know dating life personal life creepy wondering tried every way possible keep personal thing self counselor rule paranoia
@jayc6159,1 month ago,I was so close I knew it was a president but Bill Clinton came to my mind : (,close|knew|president|bill|clinton|came|mind,close knew president bill clinton came mind
@kidmerge1747,1 month ago,Bro had a real reason in order for people not to get bored out he brought entertainment a guessing game but I feel he payed the people 😂😂,bro|real|reason|order|people|get|bored|brought|entertainment|guessing|game|feel|payed|people,bro real reason order people get bored brought entertainment guessing game feel payed people
@bytextutor,1 month ago,It was informative + entertaining. The Way Oz Pearlman presented it like it was confident and catchy type !,informative|entertaining|way|pearlman|presented|like|confident|catchy|type,informative entertaining way pearlman presented like confident catchy type
@funzone_sbr,1 month ago,i dont buy it..sorry,dont|buy|itsorry,dont buy itsorry
@bromptonjourney,1 month ago,That entire section was told to say Barack Obama.,entire|section|told|say|barack|obama,entire section told say barack obama
@awesomegamer9284,1 month ago,"Btw this guy is a liar . He legit talks to people before hand in his other shows, and uses real magic tricks which other people expose, all the read minds and body language is bs😊",btw|guy|liar|legit|talk|people|hand|show|us|real|magic|trick|people|expose|read|mind|body|language,btw guy liar legit talk people hand show us real magic trick people expose read mind body language
@donttypeme,1 month ago,"Nope, it is totally, definitely MAGIC.",nope|totally|definitely|magic,nope totally definitely magic
@Mike-u1p7h,1 month ago,I read faces? 🔮✨😁,read|face,read face
@Mike-u1p7h,1 month ago,I'm a psychic 🔮✨ 😁,psychic,psychic
@lalitabhatt1173,1 month ago,Amazing 😍,amazing,amazing
@samichhyathapa7262,1 month ago,My dinner person was Trevor Noah hahaha,dinner|person|trevor|noah|hahaha,dinner person trevor noah hahaha
@arrisagoh4828,1 month ago,"how to think one person ? like think abt it, there 8 billion people alive on earth  and what if u dk the person they r thiking of?",think|one|person|like|think|abt|billion|people|alive|earth|person|thiking,think one person like think abt billion people alive earth person thiking
@blackpearl5283,1 month ago,Video is about... How ppl will watch anything posted on TedEx!!,video|ppl|watch|anything|posted|tedex,video ppl watch anything posted tedex
@pratik9882,1 month ago,"Did you experience the same, thing. My last guess or answer was right before he revealed.😮",experience|thing|last|guess|answer|right|revealed,experience thing last guess answer right revealed
@smiling.buddha,1 month ago,Total waste of time.,total|waste|time,total waste time
@fazquasha2632,1 month ago,Some sort of trick like a magician here. But I liked it.,sort|trick|like|magician|liked,sort trick like magician liked
@RamPRT,1 month ago,100% complete bullshit. He’ll go down just like Uri Geller.,complete|bullshit|hell|like|uri|geller,complete bullshit hell like uri geller
@brwaters4,1 month ago,This guy is amazing. He performed for my company and it blew everyone away. It literally makes no sense how he does it!,guy|amazing|performed|company|blew|everyone|away|literally|make|sense,guy amazing performed company blew everyone away literally make sense
@ldslao,1 month ago,Ok so i know now how tp remember names. But still dont know how to reaf minds,know|remember|name|still|dont|know|reaf|mind,know remember name still dont know reaf mind
@keithymg,1 month ago,"Everyone in the comments can be a mentalist it seems, ""he just uses simple tactics "" or ""very basic skills"" yet I have never heard of any of them, bunch of weirdos. I believe he sold his soul for this power, I'm not weird ( that's a joke, not the soul selling bute not being weird, I'm very weird.)",everyone|comment|mentalist|seems|us|simple|tactic|basic|skill|yet|never|heard|bunch|weirdo|believe|sold|soul|power|weird|thats|joke|soul|selling|bute|weird|weird,everyone comment mentalist seems us simple tactic basic skill yet never heard bunch weirdo believe sold soul power weird thats joke soul selling bute weird weird
@dcollico,1 month ago,"Thanks Oz, you made me remember the ¨Marge vs. the Monorail¨ episode. Don't know why.",thanks|made|remember|marge|monorail|episode|dont|know,thanks made remember marge monorail episode dont know
@daoul40,1 month ago,"The best thing I had learned was how to easily remember other's names. Thanks for sharing.,",best|thing|learned|easily|remember|others|name|thanks|sharing,best thing learned easily remember others name thanks sharing
@sudupa07,1 month ago,"I can't have my dinner, i have to figure out the trick or I am gonno lose my mind",cant|dinner|figure|trick|gonno|lose|mind,cant dinner figure trick gonno lose mind
@mnhertz26,1 month ago,"This guy is such a scam artist. He's great at distraction and he has very creative tactics to convince people he's reading them when he's just cheating. He uses technology. When people write on pads he gives them, it copies the writing and transmits it to Oz. His act would be great, but this takes it too far where he does a TED talk and lies to everyone about his ability to read people by convincing people he can teach them to do it too.",guy|scam|artist|he|great|distraction|creative|tactic|convince|people|he|reading|he|cheating|us|technology|people|write|pad|give|copy|writing|transmits|act|would|great|take|far|ted|talk|lie|everyone|ability|read|people|convincing|people|teach,guy scam artist he great distraction creative tactic convince people he reading he cheating us technology people write pad give copy writing transmits act would great take far ted talk lie everyone ability read people convincing people teach
@comiskey2005,1 month ago,"I call BS. Within 30 seconds of talking to someone, he gets “Alexander the Great” from the guy? Nah.",call|within|second|talking|someone|get|alexander|great|guy|nah,call within second talking someone get alexander great guy nah
@paulmosby9316,1 month ago,What a shame for TED. Absolute waste of time.,shame|ted|absolute|waste|time,shame ted absolute waste time
@KanishkaBisht-o4c,1 month ago,❤,,
@leonguerrero4099,1 month ago,"Hey Daniel. I get the first three but have trouble with the last two. As for number four, you posit that positivity is not feeling or learning from negative emotions when it's not. As for number five, who you know trumps what you know. We've all seen less technical or competent people rise faster because they have the best networks.",hey|daniel|get|first|three|trouble|last|two|number|four|posit|positivity|feeling|learning|negative|emotion|number|five|know|trump|know|weve|seen|less|technical|competent|people|rise|faster|best|network,hey daniel get first three trouble last two number four posit positivity feeling learning negative emotion number five know trump know weve seen less technical competent people rise faster best network
@zenwhitenoise7920,1 month ago,"I've had about 50 (minimum) small conversations with my UPS driver over the years, never even knew his name",ive|minimum|small|conversation|ups|driver|year|never|even|knew|name,ive minimum small conversation ups driver year never even knew name
@123XTSK,1 month ago,this is all an entertainment set up?,entertainment|set,entertainment set
@mikhail9543,1 month ago,That doesn't sound like he wrote Trevor Noah 9:20 dialogue sounds staged,doesnt|sound|like|wrote|trevor|noah|dialogue|sound|staged,doesnt sound like wrote trevor noah dialogue sound staged
@mikhail9543,1 month ago,The only thing this magician is misdirecting is the topic = how to communicate effectively,thing|magician|misdirecting|topic|communicate|effectively,thing magician misdirecting topic communicate effectively
@talhaoz,1 month ago,Might be good for entertainment as a magic show. But I thought TED was about inspiring ideas. In that regard my worst TED experience.,might|good|entertainment|magic|show|thought|ted|inspiring|idea|regard|worst|ted|experience,might good entertainment magic show thought ted inspiring idea regard worst ted experience
@appalachiankevin,1 month ago,This is fucked up!,fucked,fucked
@ConnorMoran-wr5gk,1 month ago,Bro is Harvey specter “he plays the man”,bro|harvey|specter|play|man,bro harvey specter play man
@paisano316,1 month ago,"This guy is full of crap. For example, he uses a digital clipboard that can be written on remotely and look like handwriting. what’s the answer is revealed by the guest, he has an assistant that writes the answers instantaneously on the board and then it shows it to the person and it looks like he read their mind. If you don’t believe me just search YouTube for Oz debunked.",guy|full|crap|example|us|digital|clipboard|written|remotely|look|like|handwriting|whats|answer|revealed|guest|assistant|writes|answer|instantaneously|board|show|person|look|like|read|mind|dont|believe|search|youtube|debunked,guy full crap example us digital clipboard written remotely look like handwriting whats answer revealed guest assistant writes answer instantaneously board show person look like read mind dont believe search youtube debunked
@marcosamir6468,1 month ago,Awesome! How can i read minds now 😂?,awesome|read|mind,awesome read mind
@takeshiC1,1 month ago,Repeating a name to enforce memory really works - also makes you feel more confident speaking to them because you aren't worrying that you forgot it,repeating|name|enforce|memory|really|work|also|make|feel|confident|speaking|arent|worrying|forgot,repeating name enforce memory really work also make feel confident speaking arent worrying forgot
@04hoangngocanh30,1 month ago,Vẫn cảm thấy thậy kỳ diệu làm sao,thy|thy|diu|sao,thy thy diu sao
@Mark-i3t7l,1 month ago,WOW MY MINDS BLOWN TO PICK A NAME FROM SOMEBODY'S THOUGHTS THAT YOU DO NOT KNOW IS AMAZING 😊,wow|mind|blown|pick|name|somebody|thought|know|amazing,wow mind blown pick name somebody thought know amazing
@bearsharkp3901,1 month ago,OBAMA!!,obama,obama
@jimdukeproject,1 month ago,No way haha,way|haha,way haha
@JohnDoe-l9w,1 month ago,1:27 the fat electrician or Mr.ballen😅,fat|electrician|mrballen,fat electrician mrballen
@sj8670,1 month ago,Don’t read minds or rooms .. it’s very annoying .. be ignorant and enjoy,dont|read|mind|room|annoying|ignorant|enjoy,dont read mind room annoying ignorant enjoy
@bendarbyjones172,1 month ago,Fake as,fake,fake
@mariaantoniettamontella9173,1 month ago,applausi,applausi,applausi
@shahinshashajahan,1 month ago,Hacker!!! He a hacker!!!!,hacker|hacker,hacker hacker
@mariofufi5664,1 month ago,My first fucking thought was Barack Obama 🤣,first|fucking|thought|barack|obama,first fucking thought barack obama
@CowSaysMooMoo,1 month ago,what bullshit,bullshit,bullshit
@misturanderson,1 month ago,You just have to present and intentional during the introduction.,present|intentional|introduction,present intentional introduction
@Marbforest,1 month ago,Never had a video that 100% entertained me,never|video|entertained,never video entertained
@Frosty294492,1 month ago,The skeptic in me assures me that it was 3 plants......,skeptic|assures|plant,skeptic assures plant
@Laochraiceann,1 month ago,Suspicious as can be.,suspicious,suspicious
@Go-I-CHI,1 month ago,Why am I watching a staged magic show?,watching|staged|magic|show,watching staged magic show
@Apo7even,1 month ago,Is this AI?,,
@jimhobbs3792,1 month ago,"Bullshit, unless, at the end he admits its not even body language,  its magic tricks you can learn in a day or two.",bullshit|unless|end|admits|even|body|language|magic|trick|learn|day|two,bullshit unless end admits even body language magic trick learn day two
@Mojoboogie-z8v,1 month ago,"The Art of Reading Minds and wanted to share three practical takeaways: observe nonverbal cues, ask targeted open questions, and test assumptions quickly.",art|reading|mind|wanted|share|three|practical|takeaway|observe|nonverbal|cue|ask|targeted|open|question|test|assumption|quickly,art reading mind wanted share three practical takeaway observe nonverbal cue ask targeted open question test assumption quickly
@evraya1,1 month ago,Phh,phh,phh
@skynetonrise624,1 month ago,Where's the 'How to part?',wheres|part,wheres part
@ionbeam14,1 month ago,"He (Oz Pearlman) uses nothing but trickery to do what he does. He uses gimmicks and gadgets to do most of his tricks. He uses pre-performance interviews, special notebooks/paper and electronic gadgetry to complete his tricks. Everything else is just bullshit & noise. He absolutely does not use any type of mental abilities or cues from his participants.",pearlman|us|nothing|trickery|us|gimmick|gadget|trick|us|preperformance|interview|special|notebookspaper|electronic|gadgetry|complete|trick|everything|else|bullshit|noise|absolutely|use|type|mental|ability|cue|participant,pearlman us nothing trickery us gimmick gadget trick us preperformance interview special notebookspaper electronic gadgetry complete trick everything else bullshit noise absolutely use type mental ability cue participant
@iamSOLANAA,1 month ago,"Great talk! I think the TED community could really benefit from recognizing that mentalism is its own art form. It’s much more organic than traditional magic and not just about tricks or card skills. Mentalism works on psychology, connection, and intuition — totally different world!",great|talk|think|ted|community|could|really|benefit|recognizing|mentalism|art|form|much|organic|traditional|magic|trick|card|skill|mentalism|work|psychology|connection|intuition|totally|different|world,great talk think ted community could really benefit recognizing mentalism art form much organic traditional magic trick card skill mentalism work psychology connection intuition totally different world
@iamSOLANAA,1 month ago,"Loved this! Just a reminder for the TED crowd: mentalism isn’t the same as card magic. It’s more natural, more psychological, and not based on flashy tricks. It’s a unique craft that deserves appreciation on its own terms.",loved|reminder|ted|crowd|mentalism|isnt|card|magic|natural|psychological|based|flashy|trick|unique|craft|deserves|appreciation|term,loved reminder ted crowd mentalism isnt card magic natural psychological based flashy trick unique craft deserves appreciation term
@iamSOLANAA,1 month ago,"Awesome talk! I hope the TED community starts to see that mentalism is something truly organic — not just ‘tricks’ like traditional magic. Mentalism is built on understanding people, not props, and it’s a completely different art form!",awesome|talk|hope|ted|community|start|see|mentalism|something|truly|organic|trick|like|traditional|magic|mentalism|built|understanding|people|prop|completely|different|art|form,awesome talk hope ted community start see mentalism something truly organic trick like traditional magic mentalism built understanding people prop completely different art form
@iamSOLANAA,1 month ago,Great TED talk! Mentalism deserves to be seen as its own natural art form — very different from card tricks and stage magic. It’s all about the mind!,great|ted|talk|mentalism|deserves|seen|natural|art|form|different|card|trick|stage|magic|mind,great ted talk mentalism deserves seen natural art form different card trick stage magic mind
@lasithasooriyabandara3257,1 month ago,Wow! simply unbeliverble,wow|simply|unbeliverble,wow simply unbeliverble
